i,name,halantname,type,karma,iXt,english,hindi,dhaatu,ii,startshal
१.०५६५,वल्लँ,वल्ल्, आत्मनेपदी, सकर्मकः,सेट्,"to cover, to hide, to go","आच्छादित करना, ढकना, घेरना, जाना",वल्ल्वल्लँ संवरणे सञ्चरणे चभ्वादिः,565,FALSE
१.०५६६,मलँ,मल्, आत्मनेपदी, सकर्मकः,सेट्,"to wear, to hold, to possess",धारण करना,मल्मलँ धारणेभ्वादिः,566,FALSE
१.०५६७,मल्लँ,मल्ल्, आत्मनेपदी, सकर्मकः,सेट्,"to wear, to hold, to possess",धारण करना,मल्ल्मल्लँ धारणेभ्वादिः,567,FALSE
१.०५६८,भलँ,भल्, आत्मनेपदी, सकर्मकः,सेट्,"to speak, to kill, to destroy, to injure, to give, to donate","बोलना, मारना, देना",भल्भलँ परिभाषणहिंसादानेषुभ्वादिः,568,FALSE
१.०५६९,भल्लँ,भल्ल्, आत्मनेपदी, सकर्मकः,सेट्,"to speak, to kill, to destroy, to injure, to give, to donate","बोलना, मारना, देना",भल्ल्भल्लँ परिभाषणहिंसादानेषुभ्वादिः,569,FALSE
१.०५७,कलँ,कल्, आत्मनेपदी, अकर्मकः,सेट्,"to sound, to count","शब्द करना, गिनना",कल्कलँ शब्दसङ्ख्यानयोःभ्वादिः,570,FALSE
१.०५७१,कल्लँ,कल्ल्, आत्मनेपदी, सकर्मकः,सेट्,"to sound indistinctly, to be quiet","अस्पष्ट बोलना, गूंगा होना, चुप होना",कल्ल्कल्लँ अव्यक्ते शब्दे अशब्दे चभ्वादिः,571,FALSE
१.०५७२,तेवृँ,तेव्, आत्मनेपदी, अकर्मकः,सेट्,"to play, to sport",खेलना,तेव्तेवृँ देवनेभ्वादिः,572,FALSE
१.०५७३,देवृँ,देव्, आत्मनेपदी, अकर्मकः,सेट्,"to play, to sport","खेलना, क्रीड़ा करना",देव्देवृँ देवनेभ्वादिः,573,FALSE
१.०५७४,षेवृँ,सेव्, आत्मनेपदी, सकर्मकः,सेट्,"to serve, to devote oneself, practise","सेवा करना, चाकरी करना",सेव्षेवृँ सेवनेभ्वादिः,574,FALSE
१.०५७५,गेवृँ,गेव्, आत्मनेपदी, सकर्मकः,सेट्,"to serve, to devote oneself, practise","सेवा करना, चाकरी करना",गेव्गेवृँ सेवनेभ्वादिः,575,FALSE
१.०५७६,ग्लेवृँ,ग्लेव्, आत्मनेपदी, सकर्मकः,सेट्,"to serve, to devote oneself, practise","सेवा करना, चाकरी करना",ग्लेव्ग्लेवृँ सेवनेभ्वादिः,576,FALSE
१.०५७७,पेवृँ,पेव्, आत्मनेपदी, सकर्मकः,सेट्,"to serve, to devote oneself, practise","सेवा करना, चाकरी करना",पेव्पेवृँ सेवनेभ्वादिः,577,FALSE
१.०५७८,मेवृँ,मेव्, आत्मनेपदी, सकर्मकः,सेट्,"to serve, to devote oneself, practise","सेवा करना, चाकरी करना",मेव्मेवृँ सेवनेभ्वादिः,578,FALSE
१.०५७९,म्लेवृँ,म्लेव्, आत्मनेपदी, सकर्मकः,सेट्,"to serve, to devote oneself, practise","सेवा करना, चाकरी करना",म्लेव्म्लेवृँ सेवनेभ्वादिः,579,FALSE
१.०५८,शेवृँ,शेव्, आत्मनेपदी, सकर्मकः,सेट्,"to serve, to devote oneself, practise",,शेव्शेवृँ सेवनेभ्वादिः,580,FALSE
१.०५८१,खेवृँ,खेव्, आत्मनेपदी, सकर्मकः,सेट्,"to serve, to devote oneself, practise",,खेव्खेवृँ सेवनेभ्वादिः,581,FALSE
१.०५८२,प्लेवृँ,प्लेव्, आत्मनेपदी, सकर्मकः,सेट्,"to serve, to devote oneself, practise",,प्लेव्प्लेवृँ सेवनेभ्वादिः,582,FALSE
१.०५८३,केवृँ,केव्, आत्मनेपदी, सकर्मकः,सेट्,"to serve, to devote oneself, practise",,केव्केवृँ सेवनेभ्वादिः,583,FALSE
१.०५८४,रेवृँ,रेव्, आत्मनेपदी, अकर्मकः,सेट्,"to leap, to jump, to cross by flying, to cross by swimming","उड़कर जाना, तैरकर पार करना",रेव्रेवृँ प्लवगतौभ्वादिः,584,FALSE
१.०५८५,मव्यँ,मव्य्, परस्मैपदी, सकर्मकः,सेट्,"to hinder, to tie, to bind, to stop, to resist","बांधना, रोकना",मव्य्मव्यँ बन्धनेभ्वादिः,585,FALSE
१.०५८६,षूर्क्ष्यँ,सूर्क्ष्य्, परस्मैपदी, अकर्मकः,सेट्,"to envy, to grudge","ईर्ष्या करना, द्वेष करना",सूर्क्ष्य्षूर्क्ष्यँ ईर्ष्यायाम्भ्वादिः,586,FALSE
१.०५८७,ईर्क्ष्यँ,ईर्क्ष्य्, परस्मैपदी, अकर्मकः,सेट्,"to envy, to grudge","ईर्ष्या करना, द्वेष करना",ईर्क्ष्य्ईर्क्ष्यँ ईर्ष्यायाम्भ्वादिः,587,FALSE
१.०५८८,ईर्ष्यँ,ईर्ष्य्, परस्मैपदी, अकर्मकः,सेट्,"to envy, to grudge","ईर्ष्या करना, द्वेष करना",ईर्ष्य्ईर्ष्यँ ईर्ष्यायाम्भ्वादिः,588,FALSE
१.०५८९,हयँ,हय्, परस्मैपदी, सकर्मकः,सेट्,to go,जाना,हय्हयँ गतौभ्वादिः,589,FALSE
१.०५९,शुच्यँ,शुच्य्, परस्मैपदी, अकर्मकः,सेट्,"to bathe, to give bath, to extract, to churn, to print","स्नान करना, सार निकलना, मथना, छापना",शुच्य्शुच्यँ अभिषवेभ्वादिः,590,FALSE
१.०५९१,चुच्यँ,चुच्य्, परस्मैपदी, अकर्मकः,सेट्,"to bathe, to give bath, to extract, to churn, to print",,चुच्य्चुच्यँ अभिषवेभ्वादिः,591,FALSE
१.०५९२,हर्यँ,हर्य्, परस्मैपदी, सकर्मकः,सेट्,"to go, to glow, to shine","जाना, चमकना, प्रकाशित होना",हर्य्हर्यँ गतिकान्त्योःभ्वादिः,592,FALSE
१.०५९३,अलँ,अल्, परस्मैपदी, सकर्मकः,सेट्,"to decorate, to satisfy, to fulfill, to get rid of, to complete","भूषित करना, निवारण करना, पूरा करना",अल्अलँ भूषणपर्याप्तिवारणेषुभ्वादिः,593,FALSE
१.०५९४,िफलाँ,फल्ञ, परस्मैपदी, अकर्मकः,सेट्,"to go, to break, to cut, to disassemble","जाना, तोडना, विभाग करना",फल्ञिफलाँ विशरणेभ्वादिः,594,FALSE
१.०५९५,मीलँ,मील्, परस्मैपदी, अकर्मकः,सेट्,"to blink, to wink","आँखे मूदना, पलक मारना",मील्मीलँ निमेषणेभ्वादिः,595,FALSE
१.०५९६,श्मीलँ,श्मील्, परस्मैपदी, अकर्मकः,सेट्,"to blink, to wink","आँखे मूदना, पलक मारना",श्मील्श्मीलँ निमेषणेभ्वादिः,596,FALSE
१.०५९७,स्मीलँ,स्मील्, परस्मैपदी, अकर्मकः,सेट्,"to blink, to wink","आँखे मूदना, पलक मारना",स्मील्स्मीलँ निमेषणेभ्वादिः,597,FALSE
१.०५९८,क्ष्मीलँ,क्ष्मील्, परस्मैपदी, अकर्मकः,सेट्,"to blink, to wink","आँखे मूदना, पलक मारना",क्ष्मील्क्ष्मीलँ निमेषणेभ्वादिः,598,FALSE
१.०५९९,पीलँ,पील्, परस्मैपदी, सकर्मकः,सेट्,"to be mad, to be insane, to stop, to resist, to obstruct","मुर्ख होना, थमाना, रोकना",पील्पीलँ प्रतिष्टम्भेभ्वादिः,599,FALSE
१.०६,णीलँ,नील्, परस्मैपदी, अकर्मकः,सेट्,"to color, to dye, to paint, to darken","रंगना, रंगाना, नील रंग लगाना",नील्णीलँ वर्णेभ्वादिः,600,FALSE
१.०६०१,शीलँ,शील्, परस्मैपदी, अकर्मकः,सेट्,"to meditate, to practise, to concentrate, to think, to pray, to worship","मनन करना, मन को एकाग्र करना, पूजा करना",शील्शीलँ समाधौभ्वादिः,601,FALSE
१.०६०२,कीलँ,कील्, परस्मैपदी, अकर्मकः,सेट्,to nail,"बांधना, कीलोंसे मजबूत करना",कील्कीलँ बन्धनेभ्वादिः,602,FALSE
१.०६०३,कूलँ,कूल्, परस्मैपदी, सकर्मकः,सेट्,to cover,"आच्छादित करना, ढांकना",कूल्कूलँ आवरणेभ्वादिः,603,FALSE
१.०६०४,शूलँ,शूल्, परस्मैपदी, सकर्मकः,सेट्,"to be ill, to have stomach ache, to have pain","पेट दुखना, पीड़ा होना, आंव पड़ना, बीमार होना, शूल पर चढ़ना",शूल्शूलँ रुजायां सङ्घाते सङ्कोषे चभ्वादिः,604,FALSE
१.०६०५,तूलँ,तूल्, परस्मैपदी, सकर्मकः,सेट्,to extract,सार निकालना,तूल्तूलँ निष्कर्षेभ्वादिः,605,FALSE
१.०६०६,पूलँ,पूल्, परस्मैपदी, अकर्मकः,सेट्,"to collect, to gather, to heap up, to assemble","ढेर करना, बटोरना, सञ्चित करना",पूल्पूलँ सङ्घातेभ्वादिः,606,FALSE
१.०६०७,मूलँ,मूल्, परस्मैपदी, अकर्मकः,सेट्,"to root, to be firm, to establish",जड़ जमाना,मूल्मूलँ प्रतिष्ठायाम्भ्वादिः,607,FALSE
१.०६०८,फलँ,फल्, परस्मैपदी, अकर्मकः,सेट्,"to succeed, to complete, to conclude, to get good results",सफल होना,फल्फलँ निष्पत्तौभ्वादिः,608,FALSE
१.०६०९,चुल्लँ,चुल्ल्, परस्मैपदी, अकर्मकः,सेट्,to give opinion,अपना अभिप्राय बताना,चुल्ल्चुल्लँ भावकरणेभ्वादिः,609,FALSE
१.०६१,फुल्लँ,फुल्ल्, परस्मैपदी, अकर्मकः,सेट्,"to develop, to glow, to blossom, to flourish","विक्सित होना, खिलना",फुल्ल्फुल्लँ विकसनेभ्वादिः,610,FALSE
१.०६११,चिल्लँ,चिल्ल्, परस्मैपदी, अकर्मकः,सेट्,"to loosen, to express, to speak out",ढिलाई करना,चिल्ल्चिल्लँ शैथिल्ये भावकरणे चभ्वादिः,611,FALSE
१.०६१२,तिलँ,तिल्, परस्मैपदी, सकर्मकः,सेट्,to go,जाना,तिल्तिलँ गतौभ्वादिः,612,FALSE
१.०६१३,तिल्लँ,तिल्ल्, परस्मैपदी, सकर्मकः,सेट्,to go,,तिल्ल्तिल्लँ गतौभ्वादिः,613,FALSE
१.०६१४,वेलृँ,वेल्, परस्मैपदी, सकर्मकः,सेट्,"to go, walk","चलना, जाना",वेल्वेलृँ चलनेभ्वादिः,614,FALSE
१.०६१५,चेलृँ,चेल्, परस्मैपदी, अकर्मकः,सेट्,"to go, walk","चलना, जाना",चेल्चेलृँ चलनेभ्वादिः,615,FALSE
१.०६१६,केलृँ,केल्, परस्मैपदी, अकर्मकः,सेट्,"to go, walk","चलना, जाना",केल्केलृँ चलनेभ्वादिः,616,FALSE
१.०६१७,खेलृँ,खेल्, परस्मैपदी, अकर्मकः,सेट्,"to go, walk","चलना, जाना",खेल्खेलृँ चलनेभ्वादिः,617,FALSE
१.०६१८,क्ष्वेलृँ,क्ष्वेल्, परस्मैपदी, अकर्मकः,सेट्,"to go, walk","चलना, जाना",क्ष्वेल्क्ष्वेलृँ चलनेभ्वादिः,618,FALSE
१.०६१९,वेल्लँ,वेल्ल्, परस्मैपदी, अकर्मकः,सेट्,"to go, walk","चलना, जाना",वेल्ल्वेल्लँ चलनेभ्वादिः,619,FALSE
१.०६२,वेह्लँ,वेह्ल्, परस्मैपदी, अकर्मकः,सेट्,"to go, walk",,वेह्ल्वेह्लँ चलनेभ्वादिः,620,FALSE
१.०६२१,पेलृँ,पेल्, परस्मैपदी, सकर्मकः,सेट्,to go,जाना,पेल्पेलृँ गतौभ्वादिः,621,FALSE
१.०६२२,फेलृँ,फेल्, परस्मैपदी, सकर्मकः,सेट्,to go,जाना,फेल्फेलृँ गतौभ्वादिः,622,FALSE
१.०६२३,शेलृँ,शेल्, परस्मैपदी, सकर्मकः,सेट्,"to go, walk",जाना,शेल्शेलृँ गतौभ्वादिः,623,FALSE
१.०६२४,षेलृँ,सेल्, परस्मैपदी, सकर्मकः,सेट्,"to go, walk",,सेल्षेलृँ गतौभ्वादिः,624,FALSE
१.०६२५,स्खलँ,स्खल्, परस्मैपदी, अकर्मकः,सेट्,"to stumble, to totter, to deviate, to blunder, to err, to stammer, to drop","जाना, गिरना, च्युत होना, ठोकर लगना",स्खल्स्खलँ सञ्चलनेभ्वादिः,625,FALSE
१.०६२६,खलँ,खल्, परस्मैपदी, सकर्मकः,सेट्,"to gather, to collect, to move, to shake","सङ्ग्रह करना, एकट्ठा करना",खल्खलँ सञ्चये चलने चभ्वादिः,626,FALSE
१.०६२७,गलँ,गल्, परस्मैपदी, सकर्मकः,सेट्,"to eat, to swallow, to drip, to flow, to dissolve","निगलना, खाना, भक्षण करना",गल्गलँ अदने स्रवणे चभ्वादिः,627,FALSE
१.०६२८,षलँ,सल्, परस्मैपदी, सकर्मकः,सेट्,to go,जाना,सल्षलँ गतौभ्वादिः,628,FALSE
१.०६२९,दलँ,दल्, परस्मैपदी, अकर्मकः,सेट्,"to break, to split, to expand, to open, to cut, to decline, to wither, to tear, to fade","कुम्भलाना, म्लान होना, चीरना, फाड़ना",दल्दलँ विशरणे विदारणे चभ्वादिः,629,FALSE
१.०६३,श्वलँ,श्वल्, परस्मैपदी, अकर्मकः,सेट्,to go fast,तेजी से जाना,श्वल्श्वलँ आशुगमनेभ्वादिः,630,FALSE
१.०६३१,श्वल्लँ,श्वल्ल्, परस्मैपदी, अकर्मकः,सेट्,to go fast,तेजी से जाना,श्वल्ल्श्वल्लँ आशुगमनेभ्वादिः,631,FALSE
१.०६३२,खोलृँ,खोल्, परस्मैपदी, अकर्मकः,सेट्,to limp,लंगड़ाना,खोल्खोलृँ गतिप्रतिघातेभ्वादिः,632,FALSE
१.०६३३,खोरृँ,खोर्, परस्मैपदी, अकर्मकः,सेट्,to limp,लंगड़ाना,खोर्खोरृँ गतिप्रतिघातेभ्वादिः,633,FALSE
१.०६३४,धोरृँ,धोर्, परस्मैपदी, अकर्मकः,सेट्,"to go quickly, to run, to trot, to be skillful","अच्छी रीति से गमन करना, चतुराई से चलना, जल्दी से चलना",धोर्धोरृँ गतिचातुर्येभ्वादिः,634,FALSE
१.०६३५,त्सरँ,त्सर्, परस्मैपदी, अकर्मकः,सेट्,"to creep, to crawl, to proceed crookedly, to proceed fraudulently","टेढ़ा जाना, कपट पूर्वक जाना, छिपकर जाना",त्सर्त्सरँ छद्मगतौभ्वादिः,635,FALSE
१.०६३६,क्मरँ,क्मर्, परस्मैपदी, अकर्मकः,सेट्,to be crooked,"शरीर या मन से टेढ़ा होना, वंचक होना, ठग बनना",क्मर्क्मरँ हूर्छनेभ्वादिः,636,FALSE
१.०६३७,अभ्रँ,अभ्र्, परस्मैपदी, सकर्मकः,सेट्,to go,जाना,अभ्र्अभ्रँ गतौभ्वादिः,637,FALSE
१.०६३८,वभ्रँ,वभ्र्, परस्मैपदी, सकर्मकः,सेट्,to go,जाना,वभ्र्वभ्रँ गतौभ्वादिः,638,FALSE
१.०६३९,मभ्रँ,मभ्र्, परस्मैपदी, सकर्मकः,सेट्,to go,जाना,मभ्र्मभ्रँ गतौभ्वादिः,639,FALSE
१.०६४,चरँ,चर्, परस्मैपदी, सकर्मकः,सेट्,"to go, to walk, to eat, to graze",जाना,चर्चरँ गतौ भक्षणे चभ्वादिः,640,FALSE
१.०६४१,ष्ठिवुँ,ष्ठिव्, परस्मैपदी, अकर्मकः,सेट्,to spit,थूकना,ष्ठिव्ष्ठिवुँ निरसनेभ्वादिः,641,FALSE
१.०६४२,जि,जि, परस्मैपदी, सकर्मकः,अनिट्,"to conquer, to overcome, to surpass, to win",जीतना,जिजि जयेभ्वादिः,642,FALSE
१.०६४३,जीवँ,जीव्, परस्मैपदी, अकर्मकः,सेट्,"to live, to revive, to live upon, to survive",जीना,जीव्जीवँ प्राणधारणेभ्वादिः,643,FALSE
१.०६४४,पीवँ,पीव्, परस्मैपदी, अकर्मकः,सेट्,"to be fat, to be thick","मोटा होना, स्थूल होना, पुष्ट होना",पीव्पीवँ स्थौल्येभ्वादिः,644,FALSE
१.०६४५,मीवँ,मीव्, परस्मैपदी, अकर्मकः,सेट्,"to be fat, to be thick","मोटा होना, स्थूल होना, पुष्ट होना",मीव्मीवँ स्थौल्येभ्वादिः,645,FALSE
१.०६४६,तीवँ,तीव्, परस्मैपदी, अकर्मकः,सेट्,"to be fat, to be thick","मोटा होना, स्थूल होना, पुष्ट होना",तीव्तीवँ स्थौल्येभ्वादिः,646,FALSE
१.०६४७,णीवँ,नीव्, परस्मैपदी, अकर्मकः,सेट्,"to be fat, to be thick","मोटा होना, स्थूल होना, पुष्ट होना",नीव्णीवँ स्थौल्येभ्वादिः,647,FALSE
१.०६४८,क्षीवुँ,क्षीव्, परस्मैपदी, सकर्मकः,सेट्,to spit,"मुँह से थूक बाहर निकलना, थूकना, कै करना",क्षीव्क्षीवुँ निरसनेभ्वादिः,648,FALSE
१.०६४९,क्षेवुँ,क्षेव्, परस्मैपदी, सकर्मकः,सेट्,to spit,"थूकना, कै करना",क्षेव्क्षेवुँ निरसनेभ्वादिः,649,FALSE
१.०६५,उर्वीँ,ऊर्व्, परस्मैपदी, सकर्मकः,सेट्,"to kill, to destroy, to hurt",मारना,ऊर्व्उर्वीँ हिंसायाम्भ्वादिः,650,FALSE
१.०६५१,तुर्वीँ,तूर्व्, परस्मैपदी, सकर्मकः,सेट्,"to kill, to destroy, to hurt",मारना,तूर्व्तुर्वीँ हिंसायाम्भ्वादिः,651,FALSE
१.०६५२,थुर्वीँ,थूर्व्, परस्मैपदी, सकर्मकः,सेट्,"to kill, to destroy, to hurt",मारना,थूर्व्थुर्वीँ हिंसायाम्भ्वादिः,652,FALSE
१.०६५३,दुर्वीँ,दूर्व्, परस्मैपदी, सकर्मकः,सेट्,"to kill, to destroy, to hurt",मारना,दूर्व्दुर्वीँ हिंसायाम्भ्वादिः,653,FALSE
१.०६५४,धुर्वीँ,धूर्व्, परस्मैपदी, सकर्मकः,सेट्,"to kill, to destroy, to hurt",मारना,धूर्व्धुर्वीँ हिंसायाम्भ्वादिः,654,FALSE
१.०६५५,गुर्वीँ,गूर्व्, परस्मैपदी, अकर्मकः,सेट्,to endeavour,उद्यम करना,गूर्व्गुर्वीँ उद्यमनेभ्वादिः,655,FALSE
१.०६५६,मुर्वीँ,मूर्व्, परस्मैपदी, सकर्मकः,सेट्,"to bind, to hinder","बांधना, रोकना",मूर्व्मुर्वीँ बन्धनेभ्वादिः,656,FALSE
१.०६५७,पुर्वँ,पूर्व्, परस्मैपदी, सकर्मकः,सेट्,"to fill, to complete",पूर्ण करना,पूर्व्पुर्वँ पूरणेभ्वादिः,657,FALSE
१.०६५८,पर्वँ,पर्व्, परस्मैपदी, अकर्मकः,सेट्,"to fill, to complete","पूर्ण करना, भरना",पर्व्पर्वँ पूरणेभ्वादिः,658,FALSE
