i,name,halantname,type,karma,iXt,english,hindi,dhaatu,ii,startshal
१.११३९,यमँ,यम्, परस्मैपदी, सकर्मकः,अनिट्,"to stop, to resist, to hinder","प्रतिबन्ध करना, रोकना",यम्यमँ उपरमेभ्वादिः,1129,FALSE
१.११४,तपँ,तप्, परस्मैपदी, सकर्मकः,अनिट्,"to be angry, to burn, to become hot, to envy, to glow, to shine, to perform penance, to heat, to suffer pain, to hurt","संतप्त होना, जलना, जलाना, तप्त करना, मन में या शरीर में जलना",तप्तपँ सन्तापेभ्वादिः,1130,FALSE
१.११४१,त्यजँ,त्यज्, परस्मैपदी, सकर्मकः,अनिट्,"to abandon, to leave, to quit, to let go, to renounce","छोड़ना, त्यागना, देना, दान करना",त्यज्त्यजँ हानौभ्वादिः,1131,FALSE
१.११४२,षन्जँ,सञ्ज्, परस्मैपदी, सकर्मकः,अनिट्,"to hug, to embrace, to stay in close contact, to cling, to stick to","आलिंगन करना, गले लगाना, सटे रहना, चिपके रहना",सञ्ज्षन्जँ सङ्गेभ्वादिः,1132,FALSE
१.११४३,दृशिँरँ,दृशिँर्, परस्मैपदी, सकर्मकः,अनिट्,"to see, to look",देखना,दृश्दृशिँर् प्रेक्षणेभ्वादिः,1133,FALSE
१.११४४,दन्शँ,दंश्, परस्मैपदी, सकर्मकः,अनिट्,"to bite, to sting","काटना, डसना, दंश मारना",दंश्दन्शँ दशनेभ्वादिः,1134,FALSE
१.११४५,कृषँ,कृष्, परस्मैपदी, सकर्मकः,अनिट्,"to farm, to plow, to cultivate","कृषिकर्म करना, जोतना, हल चलाना",कृष्कृषँ विलेखनेभ्वादिः,1135,FALSE
१.११४६,दहँ,दह्, परस्मैपदी, सकर्मकः,अनिट्,"to reduce to ashes, to burn, to destroy, to cause pain","जलाना, नष्ट करना, दुःख देना",दह्दहँ भस्मीकरणेभ्वादिः,1136,FALSE
१.११४७,मिहँ,मिह्, परस्मैपदी, सकर्मकः,अनिट्,"to irrigate, to wet, to sprinkle, to urinate","सींचना, गीला करना, प्रोक्षण करना, पेशाब करना",मिह्मिहँ सेचनेभ्वादिः,1137,FALSE
१.११४८,कितँ,कित्, परस्मैपदी, सकर्मकः,सेट्,"to stay, to cure, to carry out medical examination, to fight disease","निवास करना, रोग का प्रतिकार करना, चिकित्सा करना",कित्कितँ निवासे रोगापनयने व्याधिप्रतीकारे निग्रहे अपनयने नाशने संशये चभ्वादिः,1138,FALSE
१.११४९,दानँ,दान्, उभयपदी, सकर्मकः,सेट्,"to cut off, to break","खंडन करना, तोडना",दान्दानँ खण्डने आर्जवे चभ्वादिः,1139,FALSE
१.११५,शानँ,शान्, उभयपदी, सकर्मकः,सेट्,"to sharpen, to make pointed","तेज करना, तीक्ष्ण करना, पैदा करना",शान्शानँ तेजने निशाने चभ्वादिः,1140,FALSE
१.११५१,पचँष्,पच्डु, उभयपदी, सकर्मकः,अनिट्,to cook,पकाना,पच्डुपचँष् पाकेभ्वादिः,1141,FALSE
१.११५२,षचँ,सच्, उभयपदी, अकर्मकः,सेट्,"to understand clearly, to be related, to be connected, to carry germs","अच्छी तरह से समझना, संबंधी होना, संसर्गी होना",सच्षचँ समवायेभ्वादिः,1142,FALSE
१.११५३,भजँ,भज्, उभयपदी, सकर्मकः,अनिट्,"to worship, to honour, to pray, to serve","भजना, भजन करना",भज्भजँ सेवायाम्भ्वादिः,1143,FALSE
१.११५४,रन्जँ,रञ्ज्, उभयपदी, अकर्मकः,अनिट्,"to paint, to color","रंग देना, रंगना",रञ्ज्रन्जँ रागेभ्वादिः,1144,FALSE
१.११५५,शपँ,शप्, उभयपदी, सकर्मकः,अनिट्,"to swear, to take oath, to pledge, to curse, to abuse","शपथ करना, सौगंध खाना, प्रतिज्ञा करना, श्राप देना, गाली देना",शप्शपँ आक्रोशेभ्वादिः,1145,FALSE
१.११५६,त्विषँ,त्विष्, उभयपदी, अकर्मकः,अनिट्,"to glow, to shine","प्रकाशित होना, चमकना",त्विष्त्विषँ दीप्तौभ्वादिः,1146,FALSE
१.११५७,यजँ,यज्, उभयपदी, सकर्मकः,अनिट्,"to sacrifice, to offer to a deity, to worship, to get associated with, to give","यज्ञ करना, हवन करना, देवपूजा करना, संगति करना, देना",यज्यजँ देवपूजासङ्गतिकरणदानेषुभ्वादिः,1147,FALSE
१.११५८,डुवपँ,वप्, उभयपदी, सकर्मकः,अनिट्,"to sow, to plant, to chop","बीज बोना, बोना, अन्नादि काटना, केश काटना",वप्डुवपँ बीजसन्ताने गर्भाधाने छेदने बीजतन्तुसन्ताने मुण्डबीजोप्त्योः वपने घर्षणे तन्तुनिर्माणे चभ्वादिः,1148,FALSE
१.११५९,वहँ,वह्, उभयपदी, सकर्मकः,अनिट्,"to flow, to propel, to carry, to haul, to drag","बहना, झरना, ढोना, ढो ले जाना",वह्वहँ प्रापणेभ्वादिः,1149,FALSE
१.११६,वसँ,वस्, परस्मैपदी, अकर्मकः,अनिट्,"to dwell, to live, to stay","निवास करना, टिकना",वस्वसँ निवासेभ्वादिः,1150,FALSE
१.११६१,वेँ,वेञ्, उभयपदी, सकर्मकः,अनिट्,"to weave, to sew, to compose, to knit","बुनना, बटना",वेवेञ् तन्तुसन्तानेभ्वादिः,1151,FALSE
१.११६२,व्येँ,व्येञ्, उभयपदी, सकर्मकः,अनिट्,"to cover, to hide","आच्छादन करना, ढकना, सीना",व्येव्येञ् संवरणेभ्वादिः,1152,TRUE
१.११६३,ह्वेँ,ह्वेञ्, उभयपदी, सकर्मकः,अनिट्,"to vie with, to challenge, to compete, to call, to invoke","स्पर्धा करना, बड़ावरी करना, बुलाना, पुकारना",ह्वेह्वेञ् स्पर्धायां शब्दे चभ्वादिः,1153,TRUE
१.११६४,वदँ,वद्, परस्मैपदी, सकर्मकः,सेट्,"to talk, to speak, to tell, to describe, to inform, to explain to utter, to communicate","कहना, स्पष्ट बोलना",वद्वदँ व्यक्तायां वाचिभ्वादिः,1154,FALSE
१.११६५,श्विँ,श्विटु, परस्मैपदी, अकर्मकः,सेट्,"to go, to increase, to grow, to swell, to be whitened","जाना, बढ़ना, सफ़ेद होना",श्विटुओँश्वि गतिवृद्ध्योःभ्वादिः,1155,FALSE
१.११६६,ऋतिँ,ऋत्, आत्मनेपदी, अकर्मकः,सेट्,"to pity, to hate, to criticize, to abuse, to favour",,ऋत्ऋति जुगुप्सायां कृपायां चभ्वादिः,1156,FALSE
१०.०००१,चुरँ,चुर्, उभयपदी, सकर्मकः,सेट्,to steal,चोरी करना,चुर्चुरँ स्तेयेचुरादिः,1740,FALSE
१०.०००२,चितिँ,चिन्त्, उभयपदी, सकर्मकः,सेट्,"to contemplate, to think, to discuss, to remember, to worry","चिन्तन करना, स्मरण करना, याद करना, चिन्ता करना",चिन्त्चितिँ स्मृत्याम्चुरादिः,1741,TRUE
१०.०००३,यत्रिँ,यन्त्र्, उभयपदी, सकर्मकः,सेट्,"to restrain, to shy","संकोच करना, लजाना",यन्त्र्यत्रिँ सङ्कोचेचुरादिः,1742,TRUE
१०.०००४,स्फुडिँ,स्फुण्ड्, उभयपदी, सकर्मकः,सेट्,"to make fun of, to laugh at, to joke","विनोद करना, हसी करना, थट्टा करना",स्फुण्ड्स्फुडिँ परिहासेचुरादिः,1743,TRUE
१०.०००५,स्फुटिँ,स्फुण्ट्, उभयपदी, सकर्मकः,सेट्,"to make fun of, to laugh at, to joke",,स्फुण्ट्स्फुटिँ परिहासेचुरादिः,1744,TRUE
१०.०००६,लक्षँ,लक्ष्, उभयपदी, सकर्मकः,सेट्,"to observe, to see, to look, to mark, to point, to deliberate","देखना, चिन्ह करना, संकेत लगाना, तारतम्य देखना, विवेचन करना",लक्ष्लक्षँ दर्शनाङ्कनयोःचुरादिः,1745,FALSE
१०.०००७,कुद्रिँ,कुन्द्र्, उभयपदी, सकर्मकः,सेट्,to tell a lie,झूठ बोलना,कुन्द्र्कुद्रिँ अनृतभाषणेचुरादिः,1746,TRUE
१०.०००८,कुदृँ,कुद्, उभयपदी, सकर्मकः,सेट्,to tell a lie,,कुद्कुदृँ अनृतभाषणेचुरादिः,1747,FALSE
१०.०००९,कुडिँ,कुण्ड्, उभयपदी, सकर्मकः,सेट्,to protect,,कुण्ड्कुडिँ रक्षणेचुरादिः,1748,TRUE
१०.००१,लडँ,लड्, उभयपदी, सकर्मकः,सेट्,"to serve, to obey, to desire, to wish","पालन करना, चाहना",लड्लडँ उपसेवायाम्चुरादिः,1749,FALSE
१०.००११,मिदिँ,मिन्द्, उभयपदी, सकर्मकः,सेट्,"to soften, to melt, to become greasy, to love","स्निग्ध होना, पिघलना, पोतना, प्रीती करना, नरम होना",मिन्द्मिदिँ स्नेहनेचुरादिः,1750,TRUE
१०.००१२,मिदँ,मिद्, उभयपदी, सकर्मकः,सेट्,"to soften, to melt, to become greasy, to love",,मिद्मिदँ स्नेहनेचुरादिः,1751,FALSE
१०.००१३,ओँलडिँ,लण्ड्, उभयपदी, सकर्मकः,सेट्,to throw up,"ऊपर फेंकना, ऊपर उड़ाना",लण्ड्ओँलडिँ उत्क्षेपणेचुरादिः,1752,FALSE
१०.००१५,जलँ,जल्, उभयपदी, सकर्मकः,सेट्,"to cover, to hide, to cover by net","ढांकना, निवारण करना, जाल से ढांकना",जल्जलँ अपवारणेचुरादिः,1754,FALSE
१०.००१६,लजँ,लज्, उभयपदी, सकर्मकः,सेट्,"to cover, to hide, to cover by net",,लज्लजँ अपवारणेचुरादिः,1755,FALSE
१०.००१७,पीडँ,पीड्, उभयपदी, सकर्मकः,सेट्,"to harass, to annoy, to irritate, to give pain","दुःख देना, पीड़ा करना, चेताना",पीड्पीडँ अवगाहनेचुरादिः,1756,FALSE
१०.००१८,नटँ,नट्, उभयपदी, सकर्मकः,सेट्,"to enact, to dance, to act, to show",दिखाना,नट्नटँ अवस्पन्दनेचुरादिः,1757,FALSE
१०.००१९,श्रथँ,श्रथ्, उभयपदी, अकर्मकः,सेट्,"to make effort, to try, to set out","प्रयत्न करना, जाना",श्रथ्श्रथँ प्रयत्नेचुरादिः,1758,FALSE
१०.००२,बधँ,बध्, उभयपदी, सकर्मकः,सेट्,"to bind, to restrain, to control","नियंत्रित करना, बांधना",बध्बधँ संयमनेचुरादिः,1759,FALSE
१०.००२१,बन्धँ,बन्ध्, उभयपदी, सकर्मकः,सेट्,"to bind, to restrain, to control",,बन्ध्बन्धँ संयमनेचुरादिः,1760,FALSE
१०.००२२,पॄ,पॄ, उभयपदी, सकर्मकः,सेट्,"to kill, to complete","पूर्ण करना, मारना",पॄपॄ पूरणेचुरादिः,1761,FALSE
१०.००२३,उर्जँ,ऊर्ज्, उभयपदी, अकर्मकः,सेट्,"to be strong, to live with energy, to win","शक्तिमान होण, पराक्रमी होना, जीना, जिलाना",ऊर्ज्उर्जँ बलप्राणनयोःचुरादिः,1762,FALSE
१०.००२४,पक्षँ,पक्ष्, उभयपदी, सकर्मकः,सेट्,"to seize, to accept, to take side","ग्रहण करना, लेना, एक पक्ष का स्वीकार करना, एक और होना",पक्ष्पक्षँ परिग्रहेचुरादिः,1763,FALSE
१०.००२५,वर्णँ,वर्ण्, उभयपदी, सकर्मकः,सेट्,"to order, to motivate, to inspire, to paint, to color","आज्ञा करना, प्रेरणा करना, रंग देना, रंगना, खींचना, संकोच करना",वर्ण्वर्णँ प्रेरणेचुरादिः,1764,FALSE
१०.००२६,चुर्णँ,चूर्ण्, उभयपदी, सकर्मकः,सेट्,"to order, to motivate, to inspire, to paint, to color, to pull","आज्ञा करना, प्रेरणा करना, रंग देना, रंगना, खींचना, संकोच करना",चूर्ण्चुर्णँ प्रेरणेचुरादिः,1765,FALSE
१०.००२७,प्रथँ,प्रथ्, उभयपदी, सकर्मकः,सेट्,"to expand scope, to spread","विस्तार करना, फैलाना, जावना",प्रथ्प्रथँ प्रख्यानेचुरादिः,1766,FALSE
१०.००२८,पृथँ,पृथ्, उभयपदी, सकर्मकः,सेट्,"to throw, to send, to direct, to inspire","फेंकना, उड़ाना, प्रेरणा करना, भेजना",पृथ्पृथँ प्रक्षेपेचुरादिः,1767,FALSE
१०.००२९,पथँ,पथ्, उभयपदी, सकर्मकः,सेट्,"to throw, to send, to direct, to inspire",,पथ्पथँ प्रक्षेपेचुरादिः,1768,FALSE
१०.००३,षन्बँ,सम्ब्, उभयपदी, सकर्मकः,सेट्,"to join, to articulate","संयोग करना, मिलाप करना, जोड़ना",सम्ब्षन्बँ सम्बन्धनेचुरादिः,1769,FALSE
१०.००३१,शन्बँ,शम्ब्, उभयपदी, सकर्मकः,सेट्,"to join, to articulate","ढेर करना, बटोरना, एकत्र करना, जोड़ना",शम्ब्शन्बँ सम्बन्धनेचुरादिः,1770,FALSE
१०.००३२,सान्बँ,साम्ब्, उभयपदी, सकर्मकः,सेट्,"to join, to articulate",,साम्ब्सान्बँ सम्बन्धनेचुरादिः,1771,FALSE
१०.००३३,भक्षँ,भक्ष्, उभयपदी, सकर्मकः,सेट्,to eat,"भोजन करना, खाना",भक्ष्भक्षँ अदनेचुरादिः,1772,FALSE
१०.००३४,कुट्टँ,कुट्ट्, उभयपदी, सकर्मकः,सेट्,"to cut, to criticise, to blame","कतरना, निन्दा करना, दोष लगाना, रगड़ना",कुट्ट्कुट्टँ छेदनभर्त्सनयोःचुरादिः,1773,FALSE
१०.००३५,पुट्टँ,पुट्ट्, उभयपदी, अकर्मकः,सेट्,"to decrease, to diminish, to reduce, to shrink","कम होना, अल्प होना, बटोरना",पुट्ट्पुट्टँ अल्पीभावेचुरादिः,1774,FALSE
१०.००३६,चुट्टँ,चुट्ट्, उभयपदी, अकर्मकः,सेट्,"to decrease, to diminish, to reduce, to shrink","कम होना, अल्प होना, बटोरना",चुट्ट्चुट्टँ अल्पीभावेचुरादिः,1775,FALSE
१०.००३७,अट्टँ,अट्ट्, उभयपदी, सकर्मकः,सेट्,"to insult, to dishonor, to disrespect","अनादर करना, अपमान करना",अट्ट्अट्टँ अनादरेचुरादिः,1776,FALSE
१०.००३८,षुट्टँ,सुट्ट्, उभयपदी, सकर्मकः,सेट्,"to insult, to dishonor, to disrespect","अनादर करना, अपमान करना",सुट्ट्षुट्टँ अनादरेचुरादिः,1777,FALSE
१०.००३९,लुन्टँ,लुण्ट्, उभयपदी, सकर्मकः,सेट्,"to steal, to loot",,लुण्ट्लुन्टँ स्तेयेचुरादिः,1778,FALSE
१०.००४,लुन्ठँ,लुण्ठ्, उभयपदी, सकर्मकः,सेट्,"to steal, to loot","चुराना, लूटना",लुण्ठ्लुन्ठँ स्तेयेचुरादिः,1779,FALSE
१०.००४१,शठँ,शठ्, उभयपदी, सकर्मकः,सेट्,"to cheat, to fraud, to leave unfinished, to leave unattended, to ill-behave","ठीक न बनाना, आधा ही छोड़ना, असंस्कृत रखना, जाना, चलना",शठ्शठँ असंस्कारगत्योःचुरादिः,1780,FALSE
१०.००४२,श्वठँ,श्वठ्, उभयपदी, सकर्मकः,सेट्,"to cheat, to fraud, to leave unfinished, to leave unattended, to ill-behave","ठीक न बनाना, आधा ही छोड़ना, असंस्कृत रखना, जाना, चलना",श्वठ्श्वठँ असंस्कारगत्योःचुरादिः,1781,FALSE
१०.००४३,श्वठिँ,श्वण्ठ्, उभयपदी, सकर्मकः,सेट्,"to cheat, to fraud, to leave unfinished, to leave unattended, to ill-behave",,श्वण्ठ्श्वठिँ असंस्कारगत्योःचुरादिः,1782,TRUE
१०.००४४,तुजँ,तुज्, उभयपदी, सकर्मकः,सेट्,"to kill, to destroy, to hurt, to injure, to become powerful, to take, to dwell, to stay",,तुज्तुजँ हिंसाबलादाननिकेतनेषुचुरादिः,1783,FALSE
१०.००४५,तुजिँ,तुञ्ज्, उभयपदी, सकर्मकः,सेट्,"to kill, to destroy, to hurt, to injure, to become powerful, to take, to dwell, to stay","मार डालना, बलवान होना, ग्रहण करना, रहना, वसति करना",तुञ्ज्तुजिँ हिंसाबलादाननिकेतनेषुचुरादिः,1784,TRUE
१०.००४६,पिजँ,पिज्, उभयपदी, सकर्मकः,सेट्,"to kill, to destroy, to hurt, to injure, to become powerful, to take, to dwell, to stay",,पिज्पिजँ हिंसाबलादाननिकेतनेषुचुरादिः,1785,FALSE
१०.००४७,पिजिँ,पिञ्ज्, उभयपदी, सकर्मकः,सेट्,"to kill, to destroy, to hurt, to injure, to become powerful, to take, to dwell, to stay","मार डालना, बलवान होना, ग्रहण करना, रहना, वसति करना",पिञ्ज्पिजिँ हिंसाबलादाननिकेतनेषुचुरादिः,1786,TRUE
१०.००४८,लजिँ,लञ्ज्, उभयपदी, सकर्मकः,सेट्,"to kill, to destroy, to hurt, to injure, to become powerful, to take, to dwell, to stay",,लञ्ज्लजिँ हिंसाबलादाननिकेतनेषुचुरादिः,1787,TRUE
१०.००४९,लुजिँ,लुञ्ज्, उभयपदी, सकर्मकः,सेट्,"to kill, to destroy, to hurt, to injure, to become powerful, to take, to dwell, to stay",,लुञ्ज्लुजिँ हिंसाबलादाननिकेतनेषुचुरादिः,1788,TRUE
१०.००५,पिसँ,पिस्, उभयपदी, सकर्मकः,सेट्,to go,जाना,पिस्पिसँ गतौचुरादिः,1789,FALSE
१०.००५१,षान्त्वँ,सान्त्व्, उभयपदी, सकर्मकः,सेट्,"to pacify, to appease, to console","सांत्वना देना, समाधान करना, विवेक की बातें करना",सान्त्व्षान्त्वँ सामप्रयोगेचुरादिः,1790,FALSE
१०.००५२,शान्त्वँ,शान्त्व्, उभयपदी, सकर्मकः,सेट्,"to pacify, to appease, to console",,शान्त्व्शान्त्वँ सामप्रयोगेचुरादिः,1791,FALSE
१०.००५३,श्वल्कँ,श्वल्क्, उभयपदी, सकर्मकः,सेट्,"to speak, to tell, to narrate","बोलना, भाषण करना",श्वल्क्श्वल्कँ परिभाषणेचुरादिः,1792,FALSE
१०.००५४,वल्कँ,वल्क्, उभयपदी, सकर्मकः,सेट्,"to speak, to tell, to narrate, to see","बोलना, भाषण करना",वल्क्वल्कँ परिभाषणेचुरादिः,1793,FALSE
१०.००५५,ष्णिहँ,स्निह्, उभयपदी, अकर्मकः,सेट्,"to love, to be kind",स्नेह करना,स्निह्ष्णिहँ स्नेहनेचुरादिः,1794,FALSE
१०.००५६,स्फिट्टँ,स्फिट्ट्, उभयपदी, सकर्मकः,सेट्,"to kill, to destroy",,स्फिट्ट्स्फिट्टँ हिंसायाम्चुरादिः,1795,FALSE
