i,name,halantname,type,karma,iXt,english,hindi,dhaatu,ii,startshal
२.००२१,पृजिँ,पृञ्ज्, आत्मनेपदी, सकर्मकः,सेट्,"to color, to paint, to make shine",,पृञ्ज्पृजिँ वर्णेअदादिः,1177,TRUE
२.००२२,वृजीँ,वृज्, आत्मनेपदी, सकर्मकः,सेट्,"to avoid, to abandon, to leave","छोड़ना, वर्जित करना",वृज्वृजीँ वर्जनेअदादिः,1178,FALSE
२.००२३,वृजिँ,वृञ्ज्, आत्मनेपदी, सकर्मकः,सेट्,"to avoid, to abandon, to leave",,वृञ्ज्वृजिँ वर्जनेअदादिः,1179,TRUE
२.००२४,पृचीँ,पृच्, आत्मनेपदी, सकर्मकः,सेट्,"to unite, to communicate","संपर्क करना, मिलाना",पृच्पृचीँ सम्पर्चनेअदादिः,1180,FALSE
२.००२५,ूङ्,सूष, आत्मनेपदी, सकर्मकः,वेट्,"to procreate, to give birth","उत्पन्न करना, प्रसव करना, जनना",सूषूङ् प्राणिगर्भविमोचनेअदादिः,1181,FALSE
२.००२६,ीङ्,शीश, आत्मनेपदी, अकर्मकः,सेट्,to sleep,"सोना, शयन करना",शीशीङ् स्वप्नेअदादिः,1182,FALSE
२.००२७,यु,यु, परस्मैपदी, सकर्मकः,सेट्,"to mix, to join, to group","मिश्रित करना, मिलाना, मिलाप करना, पृथक पृथक करना",युयु मिश्रणेऽमिश्रणे चअदादिः,1183,FALSE
२.००२८,रु,रु, परस्मैपदी, अकर्मकः,सेट्,"to sound, to howl, to hum, to yelp, to roar, to cry out loud","शब्द करना, आवाज करना",रुरु शब्देअदादिः,1184,FALSE
२.००२९,तु,तु, परस्मैपदी, सकर्मकः,सेट्,"to go, to grow, to kill, to destroy",,तुतु गतिवृद्धिहिंसासुअदादिः,1185,FALSE
२.००३,णु,नु, परस्मैपदी, सकर्मकः,सेट्,"to praise, to worship","स्तुति करना, प्रार्थना करना",नुणु स्तुतौअदादिः,1186,FALSE
२.००३१,ुक्षु,क्षुट, परस्मैपदी, अकर्मकः,सेट्,"to sneeze, to cough",शब्द करना,क्षुटुक्षु शब्देअदादिः,1187,FALSE
२.००३२,क्ष्णु,क्ष्णु, परस्मैपदी, सकर्मकः,सेट्,"to whet, to sharpen","तीक्ष्ण करना, तेज करना",क्ष्णुक्ष्णु तेजनेअदादिः,1188,FALSE
२.००३३,ष्णु,स्नु, परस्मैपदी, अकर्मकः,सेट्,"to ooze, to drip","टपकना, झरना, चूना",स्नुष्णु प्रस्रवणेअदादिः,1189,FALSE
२.००३४,र्णुञ्,ऊर्णुऊ, उभयपदी, सकर्मकः,सेट्,to cover,ढकना,ऊर्णुऊर्णुञ् आच्छादनेअदादिः,1190,FALSE
२.००३५,द्यु,द्यु, परस्मैपदी, सकर्मकः,अनिट्,"to assail, to attack, to advance towards","शत्रु पर आक्रमण करना, आगे जाना, समीप जाना",द्युद्यु अभिगमनेअदादिः,1191,FALSE
२.००३६,षु,सु, परस्मैपदी, सकर्मकः,अनिट्,"to give birth, to procreate, to become pregnant, to possess power, to possess supremacy","उत्पन्न करना, पैदा करना, जनना, गर्भ धारण करना, अद्भुत सामर्थ्य होना",सुषु प्रसवैश्वर्ययोःअदादिः,1192,FALSE
२.००३७,कु,कु, परस्मैपदी, अकर्मकः,अनिट्,"to hum, to moan, to sound",शब्द करना,कुकु शब्देअदादिः,1193,FALSE
२.००३८,टुञ्,स्तुष्, उभयपदी, सकर्मकः,अनिट्,"to pray, to worship, to glorify, to praise","प्रार्थना करना, स्तुति करना, प्रशंसा करना, भजन करना",स्तुष्टुञ् स्तुतौअदादिः,1194,TRUE
२.००३९,रूञ्,ब्रूब्, उभयपदी, द्विकर्मकः,सेट्,"to speak, to tell, to explain","कहना, बोलना",ब्रूब्रूञ् व्यक्तायां वाचिअदादिः,1195,TRUE
२.००४,ण्,इइ, परस्मैपदी, सकर्मकः,अनिट्,to go,जाना,इइण् गतौअदादिः,1196,FALSE
२.००४१,ङ्,इइ, आत्मनेपदी, सकर्मकः,अनिट्,"to study, to learn","अध्ययन करना, अभ्यास करना, सीखना",इइङ् अध्ययनेअदादिः,1197,FALSE
२.००४२,क्,इइ, परस्मैपदी, सकर्मकः,अनिट्,"to memorize, to think","स्मरण करना, याद करना, चिन्तन करना",इइक् स्मरणेअदादिः,1198,FALSE
२.००४३,वी,वी, परस्मैपदी, सकर्मकः,अनिट्,"to go, to pervade, to surround, to attack, to be pregnant, to conceive, to glow, to shine, to throw, to eat","जनजाति, घेरना, आक्रमण करना, गर्भवती होना, गर्भधारण करना, चमकना, फेंकना, खाना, भक्षण करना",वीवी गतिव्याप्तिप्रजनकान्त्यसनखादनेषुअदादिः,1199,FALSE
२.००४४,या,या, परस्मैपदी, सकर्मकः,अनिट्,"to go, to pass",जाना,याया प्रापणेअदादिः,1200,FALSE
२.००४५,वा,वा, परस्मैपदी, सकर्मकः,अनिट्,"to go, to blow, to move rapidly","जाना, हवा की तरह तीव्र गति में चलना, बहना, गंध लगना",वावा गतिगन्धनयोःअदादिः,1201,FALSE
२.००४६,भा,भा, परस्मैपदी, अकर्मकः,अनिट्,"to glow, to shine, to look attractive, to look beautiful","चमकना, प्रकाशित होना, सुन्दर दिखना",भाभा दीप्तौअदादिः,1202,FALSE
२.००४७,ष्णा,स्ना, परस्मैपदी, अकर्मकः,अनिट्,"to bathe, to cleanse, to purify","स्नान करना, नहाना, शुद्ध होना",स्नाष्णा शौचेअदादिः,1203,FALSE
२.००४८,श्रा,श्रा, परस्मैपदी, अकर्मकः,अनिट्,"to cook, to boil, to exude, to sweat","पकाना, राघना, उबालना, पसीजना, पसीना निकालना",श्राश्रा पाकेअदादिः,1204,FALSE
२.००४९,द्रा,द्रा, परस्मैपदी, अकर्मकः,अनिट्,"to be spoiled, to act crucked, to fly, to run away, to sleep","बुरी चाल चलना, भागना, उड़ जाना, सोना",द्राद्रा कुत्सायां गतौअदादिः,1205,FALSE
२.००५,प्सा,प्सा, परस्मैपदी, सकर्मकः,अनिट्,"to devour, to eat",खाना,प्साप्सा भक्षणेअदादिः,1206,FALSE
२.००५१,पा,पा, परस्मैपदी, सकर्मकः,अनिट्,"to protect, to preserve","रक्षा करना, पालन करना",पापा रक्षणेअदादिः,1207,FALSE
२.००५२,रा,रा, परस्मैपदी, सकर्मकः,अनिट्,"to give, to grant","देना, मिल जाना",रारा दानेअदादिः,1208,FALSE
२.००५३,ला,ला, परस्मैपदी, सकर्मकः,अनिट्,"to accept, to obtain","लेना, ग्रहण करना",लाला आदानेअदादिः,1209,FALSE
२.००५४,ाप्,दाद, परस्मैपदी, सकर्मकः,अनिट्,to cut,"काटना, कतराना",दादाप् लवनेअदादिः,1210,FALSE
२.००५५,ख्या,ख्या, परस्मैपदी, सकर्मकः,अनिट्,"to explain, to make famous, to elocute","प्रख्यात करना, कहना, व्याख्यान करना",ख्याख्या प्रकथनेअदादिः,1211,FALSE
२.००५६,प्रा,प्रा, परस्मैपदी, सकर्मकः,अनिट्,"to fill, to be satisfied, to be content","भरना, तृप्त होना",प्राप्रा पूरणेअदादिः,1212,FALSE
२.००५७,मा,मा, परस्मैपदी, सकर्मकः,अनिट्,"to measure, to weigh, to limit, to compare in size","नापना, तौलना, अनुमान से सिद्ध करना",मामा मानेअदादिः,1213,FALSE
२.००५८,वचँ,वच्, परस्मैपदी, द्विकर्मकः,अनिट्,"to speak, to tell, to talk","बोलना, कहना",वच्वचँ परिभाषणेअदादिः,1214,FALSE
२.००५९,विदँ,विद्, परस्मैपदी, सकर्मकः,सेट्,"to understand, to learn, to know, to realize, to experience, to be sad, to meditate, to think","समझना, जानना, दुःखी होना, ध्यान करना, मनन करना",विद्विदँ ज्ञानेअदादिः,1215,FALSE
२.००६,असँ,अस्, परस्मैपदी, अकर्मकः,सेट्,"to be, to exist","होना, रहना",अस्असँ भुविअदादिः,1216,FALSE
२.००६१,मृजूँ,मृज्, परस्मैपदी, सकर्मकः,वेट्,"to cleanse, to purify","धोना, स्वच्छ करना",मृज्मृजूँ शुद्धौअदादिः,1217,FALSE
२.००६२,ुदिँर्,रुद्र, परस्मैपदी, अकर्मकः,सेट्,"to shed tears, to cry, to weep, to lament",रोना,रुद्रुदिँर् अश्रुविमोचनेअदादिः,1218,FALSE
२.००६३,िष्वपँ,स्वप्ञ, परस्मैपदी, अकर्मकः,अनिट्,to sleep,"सोना, निद्रा लेना",स्वप्ञिष्वपँ शयेअदादिः,1219,FALSE
२.००६४,श्वसँ,श्वस्, परस्मैपदी, अकर्मकः,सेट्,"to breathe, to live, to inhale","सांस लेना, श्वासोच्छ्वास करना, जीना, जीते रहना",श्वस्श्वसँ प्राणनेअदादिः,1220,FALSE
२.००६५,अनँ,अन्, परस्मैपदी, अकर्मकः,सेट्,"to breathe, to live, to inhale, to be able","जीना, श्वासोच्छवास करना, समर्थ होना",अन्अनँ प्राणनेअदादिः,1221,FALSE
२.००६६,जक्षँ,जक्ष्, परस्मैपदी, सकर्मकः,सेट्,"to eat, to consume, to laugh","कहना, हसना",जक्ष्जक्षँ भक्ष्यहसनयोःअदादिः,1222,FALSE
२.००६७,जागृ,जागृ, परस्मैपदी, अकर्मकः,सेट्,"to be awake, to abandon sleep, to be watchful","जागना, नींद न लेना",जागृजागृ निद्राक्षयेअदादिः,1223,FALSE
२.००६८,दरिद्रा,दरिद्रा, परस्मैपदी, अकर्मकः,सेट्,"to be poor, to be distressed, to be sad","दरिद्र होना, दुःखित होना, गरीब होना, निर्धन होना",दरिद्रादरिद्रा दुर्गतौअदादिः,1224,FALSE
२.००६९,चकासृँ,चकास्, परस्मैपदी, अकर्मकः,सेट्,"to shine, to be bright, to be prosperous, to glow","चमकना, प्रकाशित होना",चकास्चकासृँ दीप्तौअदादिः,1225,FALSE
२.००७,शासुँ,शास्, परस्मैपदी, द्विकर्मकः,सेट्,"to order, to tell, to explain, to educate, to inform, to rule, to command to punish","आज्ञा करना, कहना, बोध करना, अधिकार करना, शासन करना, शासक होना",शास्शासुँ अनुशिष्टौअदादिः,1226,FALSE
२.००७१,दीधीँ,दीधीङ्, आत्मनेपदी, सकर्मकः,सेट्,"to glow, to shine, to play, to enjoy","चमकना, प्रकाशित होना, खेलना, क्रीड़ा करना",दीधीदीधीङ् दीप्तिदेवनयोःअदादिः,1227,FALSE
२.००७२,वेवीँ,वेवीङ्, आत्मनेपदी, सकर्मकः,सेट्,"to go, to walk to pervade, to become pregnant, to conceive, to wish, to desire, to send, to eat, to taste","जाना, चलना, व्याप्त होना, गर्भवती होना, इच्छा करना, भेजना, खाना, स्वाद लेना",वेवीवेवीङ् गतिव्याप्तिप्रजनकान्त्यसनस्वादनेषुअदादिः,1228,FALSE
२.००७३,षसँ,सस्, परस्मैपदी, अकर्मकः,सेट्,to sleep,सोना,सस्षसँ स्वप्नेअदादिः,1229,FALSE
२.००७४,षस्तिँ,संस्त्, परस्मैपदी, अकर्मकः,सेट्,to sleep,सोना,संस्त्षस्तिँ स्वप्नेअदादिः,1230,FALSE
२.००७५,वशँ,वश्, परस्मैपदी, सकर्मकः,सेट्,"to wish, to long for, to desire","इच्छा करना, चाहना",वश्वशँ कान्तौअदादिः,1231,FALSE
२.००७६,रीतं,चर्क,,,,,,चर्करीतं च-अदादिः,1232,FALSE
२.००७७,नुङ्,ह्नुह्, आत्मनेपदी, अकर्मकः,अनिट्,"to hide, to conceal, to take away, to deny","छिपाना, लुकाना, चुराना, ले जाना",ह्नुह्नुङ् अपनयनेअदादिः,1233,TRUE
३.०००१,हु,हु, परस्मैपदी, सकर्मकः,अनिट्,"to sacrifice, to eat, to consume","देना, यज्ञ करना, खाना, लेना, भक्षण करना, ग्रहण करना",हुहु दानादयोः आदाने प्रीणने चजुहोत्यादिः,1234,FALSE
३.०००२,िभी,भीञ, परस्मैपदी, अकर्मकः,अनिट्,"to fear, to be afraid of, to be anxious about","भय करना, डरना",भीञिभी भयेजुहोत्यादिः,1235,FALSE
३.०००३,ह्री,ह्री, परस्मैपदी, अकर्मकः,अनिट्,"to shy, to be ashamed","लज्जित होना, शरमाना",ह्रीह्री लज्जायाम्जुहोत्यादिः,1236,FALSE
३.०००४,पॄ,पॄ, परस्मैपदी, सकर्मकः,सेट्,"to take care, to nurture, to nourish, o provide, to fill","पालन करना, पोषण करना, पूर्ण करना, भरना",पॄपॄ पालनपूरणयोःजुहोत्यादिः,1237,FALSE
३.०००५,पृ,पृ, परस्मैपदी, सकर्मकः,सेट्,"to take care, to nurture, to nourish, o provide, to fill",,पृपृ पालनपूरणयोःजुहोत्यादिः,1238,FALSE
३.०००६,भृञ्,भृडु, उभयपदी, सकर्मकः,अनिट्,"to wear, to bear, to support, to nourish, to protect","धारण करना, पोषण करना",भृडुभृञ् धारणपोषणयोःजुहोत्यादिः,1239,FALSE
३.०००७,ाङ्,माम, आत्मनेपदी, सकर्मकः,अनिट्,"to measure, to weigh, to limit, to compare in size, to shine, to appear, to sound","नापना, तौलना, मेमियाना",मामाङ् माने शब्दे चजुहोत्यादिः,1240,FALSE
३.०००८,हाङ्,हाओँ, आत्मनेपदी, सकर्मकः,अनिट्,to go,जाना,हाओँहाङ् गतौजुहोत्यादिः,1241,FALSE
३.०००९,हाक्,हाओँ, परस्मैपदी, सकर्मकः,अनिट्,"to abandon, to leave, to desert, to omit, to neglect","त्यागना, छोड़ना, परित्याग करना",हाओँहाक् त्यागेजुहोत्यादिः,1242,FALSE
३.००१,दाञ्,दाडु, उभयपदी, सकर्मकः,अनिट्,"to give, to provide, to donate, to handover","देना, सौंपना",दाडुदाञ् दानेजुहोत्यादिः,1243,FALSE
३.००११,धाञ्,धाडु, उभयपदी, सकर्मकः,अनिट्,"to wear, to obey, to wear, to bear, to support, to nourish, to protect","धारण करना, पहनना, पालन करना, देना",धाडुधाञ् धारणपोषणयोःजुहोत्यादिः,1244,FALSE
३.००१२,णिजिँरँ,निज्, उभयपदी, सकर्मकः,अनिट्,"to wash, to purify, to cleanse, to nourish, to support","शुद्ध करना, स्वच्छ करना, पालन करना",निज्णिजिँर् शौचपोषणयोःजुहोत्यादिः,1245,FALSE
३.००१३,विजिँरँ,विज्, उभयपदी, अकर्मकः,अनिट्,"to split, to separate, to divide, to distinguish, to discern","पृथक करना, अलग होना",विज्विजिँर् पृथग्भावेजुहोत्यादिः,1246,FALSE
३.००१४,विषॢँ,विष्, उभयपदी, सकर्मकः,अनिट्,"to pervade, to spread","फैलना, व्याप्त होना",विष्विषॢँ व्याप्तौजुहोत्यादिः,1247,FALSE
३.००१५,घृ,घृ, परस्मैपदी, सकर्मकः,अनिट्,"to sprinkle, to ooze out, to drip, to shine, to glow","टपकना, क्षरित होना, चमकना, प्रकाशित होना",घृघृ क्षरणदीप्त्योःजुहोत्यादिः,1248,FALSE
३.००१६,हृ,हृ, परस्मैपदी, सकर्मकः,अनिट्,"to take forcibly, to rape",बलात्कार करना,हृहृ प्रसह्यकरणेजुहोत्यादिः,1249,FALSE
३.००१७,ऋ,ऋ, परस्मैपदी, सकर्मकः,अनिट्,to go,जाना,ऋऋ गतौजुहोत्यादिः,1250,FALSE
३.००१८,सृ,सृ, परस्मैपदी, सकर्मकः,अनिट्,to go,जाना,सृसृ गतौजुहोत्यादिः,1251,FALSE
३.००१९,भसँ,भस्, परस्मैपदी, अकर्मकः,सेट्,"to frighten, to censure, to blame, to shine, to insult","भयभीत करना, दोष लगाना, चमकना",भस्भसँ भर्त्सनदीप्त्योःजुहोत्यादिः,1252,FALSE
३.००२,कि,कि, परस्मैपदी, सकर्मकः,अनिट्,"to know, to understand","जानना, समझना",किकि ज्ञानेजुहोत्यादिः,1253,FALSE
३.००२१,कितँ,कित्, परस्मैपदी, सकर्मकः,अनिट्,"to know, to understand",,कित्कितँ ज्ञानेजुहोत्यादिः,1254,FALSE
३.००२२,तुरँ,तुर्, परस्मैपदी, अकर्मकः,सेट्,"to make haste, to be quick",जल्दी करना,तुर्तुरँ त्वरणेजुहोत्यादिः,1255,FALSE
३.००२३,धिषँ,धिष्, परस्मैपदी, अकर्मकः,सेट्,to sound,शब्द करना,धिष्धिषँ शब्देजुहोत्यादिः,1256,FALSE
३.००२४,धनँ,धन्, परस्मैपदी, अकर्मकः,सेट्,"to bear fruit, to produce crops","उत्पादन करना, पैदा करना",धन्धनँ धान्येजुहोत्यादिः,1257,FALSE
३.००२५,जनँ,जन्, परस्मैपदी, अकर्मकः,सेट्,"to create, to procreate, to make","उत्पन्न करना, पैदा करना",जन्जनँ जननेजुहोत्यादिः,1258,FALSE
३.००२६,गा,गा, परस्मैपदी, सकर्मकः,अनिट्,"to praise, to acclaim","प्रशंसा करना, सराहना",गागा स्तुतौजुहोत्यादिः,1259,FALSE
४.०००१,दिवुँ,दिव्, परस्मैपदी, सकर्मकः,सेट्,"to play, to gamble, to dice, to desire to win, to transact, to glow, to shine, to praise, to please, to boast, to sleep, to wish, to go","खेलना, जीतने की इच्छा करना, व्यवहार करना, तेजस्वी होना, चमकना, प्रशंसा करना, स्तुति करना, प्रसन्न होना या करना, गर्व करना, सो जाना, चाहना, जाना",दिव्दिवुँ क्रीडाविजिगीषाव्यवहारद्युतिस्तुतिमोदमदस्वप्नकान्तिगतिषुदिवादिः,1260,FALSE
४.०००२,षिवुँ,सिव्, परस्मैपदी, सकर्मकः,सेट्,"to weave, to sew","सीना, सिलाई करना",सिव्षिवुँ तन्तुसन्तानेदिवादिः,1261,FALSE
४.०००३,स्रिवुँ,स्रिव्, परस्मैपदी, सकर्मकः,सेट्,"to go, to dry up","जाना, शुष्क होना, सूखना",स्रिव्स्रिवुँ गतिशोषणयोःदिवादिः,1262,FALSE
४.०००४,ष्ठिवुँ,ष्ठिव्, परस्मैपदी, सकर्मकः,सेट्,"to spit, to rinse the mouth","थूकना, पानी आदि को मुह से फेंकना",ष्ठिव्ष्ठिवुँ निरसनेदिवादिः,1263,FALSE
